{"artifact":{"publisherSignerSha256":"5555555555555555555555555555555555555555555555555555555555555555","sha256":"1111111111111111111111111111111111111111111111111111111111111111","sizeBytes":1048576},"build":{"channel":"pre-genesis","promotionBranch":"main","promotionCommit":"4444444444444444444444444444444444444444","repository":"The-Architect-369/Arcanum","sourceCommit":"3333333333333333333333333333333333333333"},"compatibility":{"abis":["arm64-v8a","x86_64"],"companion":{"brokerContract":"arcanum-termux-broker/1.1","nativeOperations":["probe_workspace","pair_native_client","start_broker","stop_broker","verify_workspace"],"operatorContract":"ce-w04-a13.5/five-op-v1"},"dataContracts":["hope.reflection.v0.1","tempus-anchor/0.1.0"],"minSdk":26,"targetSdk":35},"manifestType":"arcanum-own-package-update","package":{"applicationId":"org.arcanum.nativehost","versionCode":19,"versionName":"0.1.14-cew04-a14-1"},"schemaVersion":"1.0"}